ISBN,Title,Author,Date Published
0395486807,Churchill: A photographic portrait,"Gilbert, Martin",1988
0517422832,Churchill's History of the English-Speaking Peoples,Winston Churchill,1983
9781870423229,The Cabinet War Rooms,'ANON',1998
0671631535,The Private Lives of Winston Churchill,"Pearson, John",1991
9780553804638,Gandhi & Churchill: The Epic Rivalry that Destroyed an Empire and Forged Our Age,"Herman, Arthur",2008
9780553804638,Gandhi & Churchill: The Epic Rivalry that Destroyed an Empire and Forged Our Age,"Herman, Arthur",2008
9780312135058,The Greatest of Friends: Franklin D. Roosevelt and Winston Churchill 1941-1945,"Alldritt, Keith",1995
0393055949,"Roosevelt and Churchill, 1939-1941: The Partnership That Saved the West","Lash, Joseph P.",1976
0395275970,Clementine Churchill: The Biography of a Marriage,"Soames, Mary",1982
0394482964,"Special Envoy to Churchill and Stalin, 1941-1946","Harriman, William Averell",1975
9781848857186,Churchill and Company: Allies and Rivals in War and Peace,"Dilks, David",2012
9781848857186,Churchill and Company: Allies and Rivals in War and Peace,"Dilks, David",2012
0395275970,Clementine Churchill: The Biography of a Marriage,"Soames, Mary",1982
9780195161397,Churchill: A Study in Greatness,"Best, Geoffrey",2003
9781400064434,Roosevelt's Centurions: FDR and the Commanders He Led to Victory in World War II,"Persico, Joseph E.",2013
9781451609912,Young Titan: The Making of Winston Churchill,"Shelden, Michael",2013
0436068125,Winston Churchill: A brief life,"Brendon, Piers",1984
